,0
257,"Покупать андроид затакую сумму,? Люди, Вы хоть пользовались андройдом? Эти закругленные края, еще бы в форме шара сделали, для чего это???-держа в руке эта часть всегда закрывается пальцами, на изображение это ни как не влияет. Датчик отпечатка на убогой задней панеле, да и этой  надписью опять... А внутри? - вы видели как там , не продумано заточены приложения?. Сдвоенной камеры нет, что есть даже на хуавей. Bixby-только обещания от самсунга и ни какого толка. Тормозной какой-то проц, пямяти нет, акб будто ему уже лет 5... Растянут экран, для чего?-купите планшет если вам не хватает экрана. Стекло хрупкое, сильно пачкается. Нет ребята, только ios. И как бы самсунг не гнались за яблочком, им этого не сделать ни когда..."
258,Смарт отличный всё работало идеально! Но прошло ровно год и у него полетела основная плата ремонт у официалов обошёлся без малого 14 тысяч. Думайте стоит ли он этих денег!
259,"из плюсов только батарея и яркость экрана.минусу гул при записи видео ,на диктофоне.очень плохо работает камера(размытые снимки,да ещё и не всегда запускается)плохо ловит сеть"
260,"Купил этот хваленый телефон. Первое время работал на ура. Потом начал старать ерундой: не распознает отпечатки, ошибки с камерой, часто отключается от Wi-Fi. За такие деньги телефон не рекомендую"
261,"Не знаю кто это берет, но лучше в эти деньги взять какой нибудь Xiaomi
в разы будет лучше...
Не буду никогда брать дешевые самсунги"
262,"Приобрела данный телефон в августе 2016г, но модель телефона не оправдала себя: качество фото значительно хуже, чем у Sony, искажается цветопередача, сам телефон периодически зависает, спустя 8 мес эксплуатации разъем для зарядки телефона перестал распознавать оригинальное зарядное устройство, в процессе разговора самостоятельно открывается  доступ в меню - подключается блютуз. За аналогичную стоимость, можно купить телефон, лучшего качества. в Самсунгах разочарована..."
263,"Всегда брал смарты на год за 2 тр. все одно либо глюкнет, либо расколешь. Когда очередной МТСсмарт сдулся через 1 год и 1 мес (думаю заложено в них время жизни). Взял Самсунг д1. 16 год еще с гуглом на основном экране. звонит, навигация и и-нет работает. Фотки хорошие. Экран яркий. 10 дней прошло. Минусы - 1. Очень скользкий - так и норовит упасть. Нескользящие покрытие зажали. 2. Снятие блок экрана всегда со 2 попытки. 3. Яндекс глючит - не дает редактировать сроку ввода. 4. Сегодня его роутер не пошел в ПК. Короче, начинаю думать, что надо было за 2 тр купить и не париться. на 60% оцениваю эту штуку."
264,"Купил этот телефон немногим более месяца назад. Что-то определенно о данной модели сказать сложно. Много плюсов, но и много минусов. Действительно экран яркий и неплохой звук при вызове, разговоре при работе плеера. Но плохо держит заряд батареи, заряжать приходится каждый день, а иногда и по два раза в день. Я даже уже купил внешний аккумулятор. Иногда может просто так сам тормознуть, самопроизвольно убавиться яркость экрана, зависнуть даже при наборе СМС. В целом модель не плохая, внешне красивый, ничего лишнего. Но откровенно говоря лучше взять несколько дороже, к примеру SAMSUNG Galaxy A3, уверен что это модель будет значительно лучше!"
265,"Телефон купила чуть больше года назад,сначала работал хорошо.После года использования телефон стал зависать во время разговора появляется черный экран,приходится вытаскивать батарею.Во время использования стал медленнее работать.Для активного пользования не подойдет."
266,"Покупался в подарок, так что особо с ним не ""общался"" но он определенно стоит своих денег, в качестве подарка подошел идеально!"
267,"Недостатки:
-какие-то неполадки, связанные с входом в Интернет и подключением к некоторым Wi-Fi сетям, но это пустяки, с этим можно легко разобраться
-аккумулятор на 2050мА на час еле-еле выдерживает 1 день работы, половина заряда может просто уйти за ночь, поэтому приходить 1-3 заряжать аккумулятор, а ночью выключать смартфон."
268,"Сгорела материнская плата, после покупки через 1год 1 месяц. Гарантия всего 12 месяцев. Соответственно замена из своего кармана. А так отличный телефон, годовалая дочь отлично играет теперь с ним, пуская на него слюни."
269,"Выбрала этот телефон по рейтингу камеры(стоит на первом месте и сравнивает я с xs Max), переходила с айфона plus,нужна хорошая камера. В руках держать нет желания, цвета на фото не нравятся (в помещении),  по мне цветопередача у айфона лучше, пусть и немного айфон искажает цвет, зато фото сочные, красивые . У хуавей портрет плывёт, видео размывается, на концерте к примеру.  О покупки жалею, лучше бы сразу Max взяла, больше сравнить не с чем, выбирала между ними."
270,ни к чему переплачивать такие деньги за бренд!!!а по поводу самсунга могу поспорить!!!если брать 5s то его можно сравнить с нотом 3 или как минимум с с4!!!по скорости они не плохи а по дисплею еще и лучше!!!минус в с4 только дизаин!!!так гоняю с с4 просто шикарный аппарат!!!всем советую!!!
271,"Вчера купила, сегодня вернула.  Очень неприятный экран -  с нормальной контрастностью видно только  под одним углом,  отступ вниз-вверх - и изображение уже ""засвечено"", как ни настраивай яркость. Напомнило первые ЛСД мониторы.
Кнопки болтаются. Через 2 часа после использования начал подвисать, отказывался отключать вай-фай (пришлось каждый раз в настройки идти), произвольно отключал экран.
 Вердикт - не стоит брать."
272,"Вначале очень понравился. Вроде даже игры тащит, стоит своих денег. Камера как камера. Месяц спустя начал себя проявлять, батарея не держит даже до конца рабочего дня, хотя использую только для обещния по телефону и вотсапа. Ни фильмов, ни игр, ничего такого. Стал часто подвисать и вовсе зависать. Тач не всегда откликается. Потом и вовсе, упал с кровати на ламинат, то есть с высоты 40 см на дерево. Разлетелось все стекло. Меняют только тачем полностью. Стоимость - около 6000, то есть почти новый телефон. Но и при этом: во всем городе, даже в сертифицированном сервис-центре, на него нет запчасти! То есть даже за такие деньги его не починить. В общем одноразвая штука. Деньги на ветер. Не обольщайтесь, хороший и дешевый понятия несвместимые"
273,своих денег уже давно не стоит….только фанатам яблока
274,"Этим смартом пользуюсь уже больше полугода и он устраивает меня всем.  Шикарный экран,  производительный, удобный. Очень понравилась кнопки со сканером. Сканер быстрый. А еще нас этой кнопке функции возврата «домой», «назад» и еще в настройках можно повесить функции. Флайми оказался удобным. Только все приложения на рабочих столах,нельзя просто ярлык удалить (нет отдельного меню приложений). Но это мелочи, в папку скидываю лишнее и все. Смартфон очень хороший, берите)"
275,"нареканий не было, но после двух лет стал ""зависать"". Запускала путем вытаскивания батареи. Но перестал и на это реагировать-нужно нести в ремонт"
276,Все отлично кроме одного - очень хрупкий экран. При случайном падении стекло разлетается вдребезги и замена этого тачскрина стоит половину стоимости телефона!!!
277,"Не возможно слушать музыку через aux. Общение через наушники не возможно, вас плохо слышит собеседник. А так в основном не плохой телефон."
278,"На третий день сломался. Батарея вышла из стоя, не заряжается и не включается."
279,"После прочтения всех отзывов о бюджетных смартфонах решила приобрести данную модель.
 Из плюсов - быстрый отклик, не глючит, не тупит , за полгода в этом плане никаких нареканий. Заряд держит хорошо, хватает надолго. 
Из минусов-очень слабая камера, что фронтальная, что обычная. Качество стекла тоже страдает, при малейшем падении сразу трескается, меняла уже 3 раза за 9 месяцев использования. Моя оценка 3/5."
280,"Хороший телефон. Держа в его в руке особой разницы не ощутил, так как переходил с восьмерки, но экран - это блеск, шик. Яркий и огромный!"
281,"Телефон хороший. Камера при дневном свете хорошая, с фото вспышкой с двух сторон. Но!  Очень маленькая память и заряд телефона на  пол дня. Без мобильной сети, как звонилка держит заряд пару дней. Но, пользуюсь я им постоянно, целый день. Поэтому заряда мало, очень мало. Быстро заряжается и так же быстро разряжается. Дочери такой покупать уже не буду."
282,"Не знаю в чем уж тут дело,но по отпечатку пальца иногда заходит с первого раза,иногда и с 6 не заходит,блокируется и просит ждать аж до 10минут доходит!"
283,"Купила его в подарок, приятная цена и красивый телефон, только столкнулась с одной проблемой, я сама айфончик, поэтому сложность  работы с андройдом привела к тому, что подцепила я вирус какой то системный, и началось тут у меня самое интересное, телефон зажил своей жизнью, при подключении Wi-Fi, интернет начинал скачивать  все подряд без остановки, пришлось сдавать в ремонт, прошивка вроде помогла, пока работает."
284,На 4-ом месяце использования перестала работать камера. Повезем в гарантийку.
285,"Красивый - да
прикольный - да
но не стоит , купил и разочаровался !!!"
286,"Купили телефон .при покупке продавец уверял ,что устройство выдерживает погружение на 1 метр в течении полу часа .походили с ним 2 недели.попали под дождь ,телефон лежал в наружном кармане рюкзака.теперь не работает подсветка и посинела нижняя часть дисплея.ОДНИМ СЛОВОМ."
287,Аппарат хороший но срок работы очень разочаровал(((
288,Оч крутой
289,Очередной развод по Амерекански. За такие деньги он летать должен!
290,"Из плюсов только то, что первые пол года он работал хорошо. Телефону полтора года, а он ужасно зависает, вылетает из приложений, когда звоню кому-то, то включается динамик и чтобы выключить его, надо два раза нажать на динамик, когда делаю минимальную яркость экран начинает мигать, до тех пор, пока не увеличу яркость, когда слушаю музыку, каждые минут 5 она останавливается. А теппрь и вовсе перестал работать фонарик. Ужас, а не телефон, даже денег своих не стоит."
291,Телефон просто отличный! Но через 6 месяцев использования залипла кнопка home и телефоном стало невозможно пользоваться
292,"Не очень, выбрала бы другой"
293,"Телефон куплен недавно ,выбирал эту модель из за качественного дисплея ,пока всем доволен.Приятно пользоваться смартфоном ,ни каких лагов"
294,"телефон норм , учитывая его размеры . только накрылся быстро : виснет , разряжается , слабоват однако"
295,"Отличный смартфон, пользуюсь 2 дня все работает на «отлично». Все заявленные характеристики соответствуют действительности."
296,Я не знаю почему тут так все нахваливают камеру в 13 мегапикселей. В работе она и на 5 то не тянет. Очень размытые фото ооочень долго фокусирует и от того что сфокусировала фото все равно ужасного качества. С фронтальной камерой та же история спасает то что у фронтальной камеры есть всышка она немного исправляет ситуацию. И если бы не камера то в целом телефон хороший.
297,"Пользуюсь только один день,впринципе довольна,но не понятно заявлен андроид один,а по факту версия 6.0. 1 както нестыковочка,но мне не очень это понравилось,коробка с пломбами,нарушений целостности нет,возникает вопрос тогда почему он уже был заряжен"
298,"мне не понравился. взял из-за дизайна. очень красиво смотрится. но работает так себе. и цена все же сильно завышена. тут пишут телефон висит, на самом деле не висит просто плохо отзывается на нажатие. приходится нажимать пару раз не сразу реагирует. на морозе оставил в машине, дисплей покрылся инеем и вообще перестал отзываться на нажатие. сказали случай не гарантийный.  в принципе наверное телефон хороший, но только не для России, а для более южных стран."
299,"Очень слабый телефон, хотя позиционируется как модель среднего уровня.  Из плюсов в дополнение к внешнему виду неплохая камера. На этом положительные стороны заканчиваются. Минусы: просто ужасно тормозит, оперативной памяти не хватает даже для того, чтобы удерживать два приложения: стоит выйти из одного приложения и на секунду включить другое, а затем вернуться в первое - все, сессия в первом пропала. То есть, ни о какой многозадачности и речи нет. Приложения запускаются очень долго, реально тормозят. И это при том, что у меня нет особых запросов к производительности, просто хочется, чтобы не было лагов. В общем, разочарование."
300,"Красивый, две симки

Минусы: тормозит на простейших операциях (при 1gb свободной оперативки из 2х), сканер часто срабатывает со второго раза, камера в сумерках никакая."
301,"через пару недель, сам собой изогнулся корпус и на всех углах появились трещины! до этого был 6с про, остался доволен, заценил марку. и тут на тебе.. а по производительности и тд. нареканий нет. хотя чему тут удивлятся, когда и хваленые самсунги тоже порой и глючат и взрываются, были случаи. хорошо что застраховал, планирую сдать."
302,"Телефон не оправдал своих ожиданий, зарядку  не держит больше 6 часов, обычный телефон на андроиде,каких-либо супер функций не заметила"
303,"Долго выбирал себе новый телефон, остановился на этом. В целом неплохой, но есть одно большое НО - это кусок мыла, а не телефон, все остальные плюсы и минусы отходят на второй план, по сравнению с этим. Пользоваться невозможно. Куда только смотрели разработчики. Конечно на витрине он красивый, блестит, но из рук валится постоянно, поэтому думаю долго он у меня не прослужит. Хорошо, что в эльдорадо купил его с хорошей скидкой по акции. В общем Эльдорадо 5, телефону 3, только из-за эргономики."
304,"Очень тихий, в машине постоянно пропускаю звонки т.к. не слышу, слабый виброзвук, плохо ловит сеть на 3G. Wi-Fi, если сравнить с алкатель у мужа, кино, видео через Wi-Fi, c перебоями, на алкатель летают. это большой минус."
305,"Мне телефон очень нравился, особенно фотографии идеального качества, но не прошло и года, как потек экран! Не известно по каким причинам, телефон не роняла не давила. Вечером положила, легла спать утром проснулась а на экране огромное синее пятно которое росло пока не заполонило весь экран. Ставить новый дисплей стоит почти столько же сколько и новый телефон. Теперь не знаю что делать..."
306,"Телефон сам сделан каыественно, учтенно много мелочей, которые являются дополнительным бонусом! Есть большой МИНУС - СВЯЗЬ ЛОВИТ ОЧЕНЬ ПЛОХО!! за три дня его существования у меня - очень много смс о пропущенных звонках. еще он не громкий, звонки и смс очень тихие! немного разочаровалась"
307,"Первый телефон купила, пошла на следующий день менять, оказался бракованным (меня слышали, я не слышала). Поменяли без проблем, посоветовав ""нормальный телефон купить"". Смысл слов дошёл позже. Нагревается жутко. Батарея садится быстро, буквально 5-6 часов с интернетом. Тормозит с приложениями. Не всегда срабатывает экран, порой просто невозможно разблокировать."
308,пользуюсь слишком короткое время для оценок
