,0
467,"Купил сей девайс. Повелся на характеристики камеры, так как нужен был смартфон с камерой выше среднего.
В общем камера отстой, фокусировка непонятно по какому принципу работает. На экране изображение нормальное, по факту результат не радует, есть размытость, детализация низкая. В общем уровень телефона за 10 000. При общении в скайпе собеседник слышит посторонний шум. Непонятно как включить GPS. Отсутствует информация по этому вопросу, надо разбираться. Меню настроек слабое, нелогичное.
В общем покупкой недоволен, выброшенные деньги."
468,"Всё было бы прекрасно, если бы не одна проблема: смартфон не видит наушники. Никакие."
469,"Купила себе данный телефон в феврале 2018г. На днях наконец то поменяла  его  на другой. ООООООчень сильно висит, все приложения открывает по 2 мин, оперативки мало для быстродействия.Камера плохая, в темноте не получаются фото вообще, ничего не видно ни при одном из выбранных режимов съемки. Единственный плюс - долго держал заряд батареи. За это +1 балл. В остальном - не советую."
470,"Купила в марте, первое время была очень довольна всем, очень качественные снимки, но емкость батареи не соответствует заявленной. Первую неделю работал 6 часов без подзарядки, потом только 1-2 часа без зарядки. А через 3 месяца вообще перестал заряжаться. Сдала в сервис центр. Ремонт 45 суток. Жду результата."
471,"Редкая дрянь! Дали в качестве подмены, пока мой в ремонте... Пользуюсь две недели... Регулярно виснит, тормозит... Сказал бы ""живёт своей жизнью"", но скорее ""померает своей смертью"". Страшно глючит даже просто при работе (звонки, ЧАТы), а если смотреть видео по сети (например через ВК) то иногда хочется разбить с периодичностью 4-5 раз в минуту. Подобного убожества ещё ни разу в руках не держал."
472,Только интернет и звонки и все
473,"Телефон хороший ,рекомендую."
474,надеялась на лучше но после 2 месяцев пользования разочерована телефоном.
475,Шляпа
476,"Эйфория от покупки прошла в этот же день, когда батареи хватило часов на 5, но я утешала себя, что пока батарея, возможно, не прокачена на 100%. Пользовалась в течение недели, постоянно заряжала и на работе, и дома, уже началось недовольство аппаратом. Затем в один прекрасный день телефон начал перезагружаться сам по себе.  Это вызвало еще больший негатив. Чашу терпения переполнило то, что вдруг ни с того ни с сего стерлись все установленные приложения сами по себе, без моего участия, а также повредилась внешняя карта памяти. Вот такой вот ""отличный телефон"". Заявленная память 4ГБайта, а показывает 2ГБайта, толком ничего не входит, так как большинство приложений устанавливается все же во внутреннюю память телефона. Так что сегодня иду сдавать обратно в магазин, благо 14 дней еще не истекло. Возможно мне такой бракованный попался, но не думаю, что другие лучше. Что-то в нем недоработано, а батарея, так вообще нонсенс при таком размере экрана и функционале."
477,Ни о чём!
478,"Неделю как купила, по прошлому телефону 3403 думала, что будет такой же. Но увы:(("
479,"Мне повезло купить бракованный айфон.
Заблокированный экран светится легким синим цветом, словно это ночник а не телефон. А иногда экран просто не включается, остается черным, звонки при этом и сигналы сообщений могут поступать, но ответить-то не возможно...
Перезагрузка телефону не всегда помогает, он может просто не реагировать на нажатия кнопок (или этого просто не видно), оставаясь черно-розовым кирпичом, и тогда вообще сложно понять, работает он или нет.
Авторизованный сервисный центр и магазин уже больше года в течение гарантийного срока и после него, не могут справиться с этой бедой. Сервисный центр колдует с телефоном три недели, вернет его, а через пару недель снова та же история ((
Очень, очень плохой телефон! Не стоит покупать.
С четверкой и пятеркой таких проблем не знала."
480,"после самсунга идеальный, и цвет такой нежный, не вульгарный розовый как я боялась."
481,"Успела попользоваться всего 3 недели, стал быстро падать заряд батареи. Отдала в сервис. Теперь жду новый... Жаль,что успела порадоваться так недолго..."
482,"Цвета передача ни какая, батарея очень очень слабая. Это  не финская нокиа, и даже не хороший Китай."
483,"Время работы 10 минут. Затем погас,  и больше включаться не захотел. На сервисе оформили возврат..... Печаль."
484,"Ужасно. Поначалу все было нормально. Через месяц пользования проявилась проблема с памятью. Приложения ни то что не установить нельзя, они даже обновиться не могут. Через полгода пользования появилась еще проблема. Сначала вы на экранную клавиатуру нажимаете и только через пару секунд он высвечивает результат. А также начали тормозить приложения жутко. Вплоть до того, что Twitter сразу вылетал после включения. Фронтальная камера ничего из себя не представляет. Пользоваться невозможно. Не стоит  брать."
485,"вот все вроде бы нормально с телефоном, летает, не тупит, но есть одно но, ПРОБЛЕМА С ПАМЯТЬЮ!!! приходится ограничеваться 2-мя 3-мя приложениями, потом пишет недостаточно памяти. обидно!"
486,купил дочери на днюху.хватило на день.потом отказал экран.короче брак.забрал деньги.
487,"Купила такой телефон. В инете смотрю видео всё зелеными квадратами покрывается,а ему 5 дней. Повезу обратно"
488,"Телефон сам по себе не плохой, но очень мало памяти 8 гб и они все заняты системными приложениями . Ничего нельзя скачать , кроме ватсапа на телефоне ничего нет и тот скоро придется удалить."
489,Ужасный телефон.Маленькая память.Скачали три приложения и память закончилась.Не советую.
490,"Как телефон работает нормально. Но как смартфон использавать невозможно!!!! 4 приложения и память кончилась. На карту памяти приложения не устанавливаются. Самсунг разочаровал. Раньше только этот бренд рассматривала. Теперь буду искать другие варианты. До этого у меня был гранд прайм. С таким же объемом памяти. Но его хваьала на самые необходимые приложения. А в этот напихали столько не нужного, что приходится выбирать или навигатор установить или сбер ((("
491,"Батарейку держит полдня. Сыну на ДР подарили в июле, к октябрю уже выдохся. Не играет, просто лежит на полке и все-равно быстро садится - проверяли несколько раз, приложения никакие не грузит (думали, что из-за них садится), все очистили, интернет отключили. Считаю, что просто не повезло с аккумулятором. В остальном хороший телефон"
492,"Прочитала характеристику телефона, отзывы. Впечатление создалось что неплохой телефон, а на деле оказалось что это не так.... хотелось бы его вернуть, избавиться бы поскорее"
493,"Телефон отличный по цене/качеству,игры тянет.Минусов почти нет.Для подростка самое то. Всем удачи!"
494,"Долго выбирал, хотел самсунг взять, не слишком дорогой, рабочий. Но разочаровался. Батарея совсем слабая, к вечеру уже телефон выключается. Не рекомендую"
495,"использую телефоны (2шт) 2 года. время от времени телефоны удаляют все файлы из памяти (фото, видео, музыку, тексты,вложения)- началось после окончания гарантии через 2 дня. греются при работе в интернете до 50 градусов (держать в руках невозможно), сдавал в ремонт по гарантии в м-видео - ничего страшного, не взорвался еще. несколько раз зависали- не включается, не выключается (несколько дней пока полностью не разрядился). достоинства- крепкий (падал много раз), шустрый (в интернете думает быстро), камера быстрая и качественная, стоит своих денег"
496,"Телефон очень хороший. Прикольный дезаин, камера. Но есть один минус после 6 месецов он перестал находить сим карту. Менял симку всё равно также"
497,"В общем все устраивает, большой плюс батарея, но я покупал с учетом того, что буду использовать еще как навигатор, вот здесь все плохо, gps все время теряется и все время перестраивается маршрут, уже нервирует. Ты едешь прямо и никуда не поворачиваешь, а навигатор куда-то налево или направо сворачивает и ""маршрут перестроен, маршрут перестроен"""
498,"В первую очередь отрываются заглушки.Греется очень и из-за этого отклеились передняя,и задняя панели.Наушник стал плохо воспроизводить звуки.Начались эти неполадки ровно после окончания срока гарантии.Сдали в ремонт по доп.гарантии магазина-продлили, заменили наушник.Но во время зарядки нагрелся и все панели отклеились вновь.Пришлось сдать опять в ремонт.Через месяц ожиданий разрешили обмен."
499,"Телефоном недоволен,батарея не соответствует заявленной мощности,выход на наушники очень тихий,в интернете самопроизвольно выскакивают непонятные страницы,камера нормальная ,стекло тоже не соответствует параметрам защиты,поцарапалась ключами в кармане,на водонепроницаемость не проверял."
500,"Телефон куплен меньше 2х недель назад.Всё хорошо,но по несколько раз в день необходимо его перезагружать,чтобы заработал динамик.Не слышу звонки,смс и гудки при дозвоне"
501,"У смартфона потенциал есть, но производитель урезал производительность процессора. Прималейшем нагреве начинает в играх жутко лагать. Если вы не играете в игры то смартфон отличный, но как игровой его использовать не получится, даже если вы знаете как прошить и думаете что всё нормально будет, сразу говорюТАКОГО НЕ БУДЕТ! Всё 4pda изучил, сам пытался настроить работу процессора всё в пустую.  Сам купил этот смартфон и теперь продаю, так как хотелось бы в игры играть без проблем, на нём без вариантов. Лучше если найдёте купите Xiaomi Redmi Note 3 Pro, модель старенькая, ну там всё настроенно так как надо."
502,камера для селфи снимает зеркально. т.е. где левая сторона - будет правой и наоборот
503,Телефон у меня уже около 6месЦев начал жёстко лагать тормозить не советую лучше хиоми  редми 3 или 4
504,"Телефон так себе , пользовался всего 2 месяца словалсся провод для наушников . Телефон тоже стал плохо работать ."
505,Телефон сыроват.
506,"Купила 2 недели назад, хочу вернуть."
507,"вообще в корне не согласна с предыдущим комментом! обожаю телефоны sony,мой м2 отслужил мне верой и правдой 2 года,потом я его уронила и он начал жить своей жизнью(отключался периодически)и тут я увидела рекламу Е5!!!КОРОЧЕ,купила я его в ноябре,а в мае он уже не заряжался вовсе!!!заряд не держит,камера убогая,тусклые цвета,такое впечатление,что это внебрачный сын Sony!а моим М2 сейчас пользуется дочь и если его не стукать и ронять он работает бесперебойно-уже 4года!!!!!"
508,"Ужасный телефон! Нормально не работает, мне кажется, ни одна функция.
Зарядку держит при активном разговоре пол дня. Клавиши не срабатываю.
Зависает даже при попытках позвонить. При входящем звонке периодически не
загорается экран, ответить на звонок нельзя. Зато при разговоре, даже при гаснущем экране нажимаются кнопки, отключается звук.
Камера просто нет слов все размытое.
В руках держишь как детскую игрушку.
До этого был Флай, на бетон раз пять падал и работает даже при расколотом экране.
Не советую!"
509,"В общем покупкой не доволен .цена хорошая но нервов потратите не мало .подвисает постоянно,в инете медленно все открывает. то контакты невидет перезагружаю,то связь не ловит перезагружаю.динамик ужасный собеседника плохо слышно на что в сервисном центре сказали все нормально.экран в жолтых пятнах выгорает.больше не буду покупать телефоны не давних брендов. Лучше переплатить взять самсунга и не тратить нервы либо другом известный бренд.так что не ведитесь на новинки китайские"
510,Спустя месяц во время разговора стал пропадать звук с динамика. Приходится на него надавить чтобы слышать собеседника.
511,"У меня телефон не проработав две недели пришел в негодность, перестал работать сенсор вообще."
512,"Телефон сразу был не лучшего качества,  плохое звучание, динамик сел через 4 месяца использования. Отдала по гарантийке на ремонт. На вид интересный презентабельный, камера хорошего качества,  очень плохо держит зарядку, при максимальной яркости в работе хватает на 2 часа."
513,"К сожалению, телефон не лучшего качества, сломался через 2 месяца! Если сравнивать по работоспособности, то он отстает в разы от SAMSUNG Galaxy A3 2015, в том числе и качеством камеры!Прекрасный дисплей, но если сделать яркость хотя бы на 50%, телефон разряжается за 3 часа."
514,"Да,может он и очень красивый, очень быстрый, просто не телефон, а мечта, отличная камера, удобен в использовании, но про батарею вы наверное пошутили? Её хватает ровно на полдня при не слишком активном использовании, за такую цену это очень существенный недостаток. Не рекомендую"
515,Как можно купить современный телефон с такими огромными рамками...
516,"стоит огого ,а толку ?есть модели других фирм производителей по параметрам даже лучше,а этот очередная сборная солянка со всего мира."
517,"Золотой айфон 7! Все, как с ума посходили с этими яблоками. Теперь еще и 256 Гб - стоить, наверное, будет, как кусок золота. По мне - так ничего особенного"
518,"Пользуюсь 3 месяца, за это время упал один раз и то на мягкий ковёр,"
519,Испытал на себе. Брать не стоит хоть и выглядит не плохо. Стекло разбил через неделю. Глючит не по детским на вид что это операционная или начинка.
520,"+ Смартфон действительно на 2011-2012 год самый оптимал. Игры-фильмы-камера, всё на высоте, даже дисплей хоть и не супер АМОЛЕД но ООчень достойный."
521,Вот грамотеи - КНР это Китайская Народная Республика http://ru.wikipedia.org/wiki/Китайска...Республика
522,Товарищи
523,"Телефон прослужил верой и правдой 2 года. Ни разу не подводил. Спустя 2 года отключился и больше не включился. В ремонте сказали, что дешевле купить новый телефон, чем этот отремонтировать."
524,не кому не советую брать этот телефон. ломался 2 раза первый раз сделали проработал меньше месяца и опять тоже самое всё таже причина  .И характеристика не устроила камера плохая короче не советую
525,"Телефон вроде и не плохой, все нравится, правда скользкий."
526,Этот телефон меня научил не делать покупку поспешно.
527,"Динамик слабый, при разговоре очень плохо слышно и тебя и тебе. Батареи хватает примерно на 18-20 часов работы т.е. меньше суток. Телефон проработал без сбоев ровно год, после чего начал ужасно глючить и выключаться. Не советую данную модель."
528,"Купил данный смартфон в сентябре,теперь лежит в коробке!!! Микрофон слабый и глухой звук,собеседник меня плохо слышит."
529,если бы было ноль звезд то поставил бы.
530,"Телефон приятный, много функциональный, но ложка дёгтя всё-таки есть. Микрофон глухой и собеседник тебя плохо слышит, именно очень плохо, второе камера, а вернее её программное сопровождение, снимки получаются синюшными и очень тормозная ( немного поправляет ситуацию установка съёмка в движении )."
