,0
0,3/5
1,"Переход с 7го айфона на 11 не вызвал никаких впечатлений. Первое, на что обращаешь внимание - неудобство в использовании. Теперь девайс требует задействовать обе руки. Второй недостаток, который со временем даст о себе знать, это стекло с обоих сторон. Царапается оно очень легко. Особенно критично поцарапать стекло в районе камеры. Основная камера хороша. А ширик не поддерживает ночную съемку, да и вообще требователен к освещению. В целом телефон неплохой, но без вау-эфекта."
2,"Телефон с отличной автономностью. В вопросах производительности нареканий нет! 
Тем не менее смог пропользоваться телефоном 4 месяца, так и не привыкнув к его габаритам. Телефон крайне не удобен в одной руке. 
С этим всем ещё можно было бы смириться но оказалось что у серии Xr есть массовый брак с пятнами на дисплеях. В итоге отказался от этого телефона."
3,"За свою цену слабый смартфон. Быстро разряжается, лагает. Честно говоря, даже не знаю, по поводу камеры. Как только солнечного света становится меньше совсем чуууть-чуть, так сразу же она снимает просто отвратительно. Да, красивый экран, дизайн самого смартфона, но я бы лучше взял тот, который некрасивый, но мощный. К сожалению, не рекомендую этот смартфон, хотя все остальные смарты показали себя с лучшей стороны. Этот мне ну не очень понравился. Выглядит знатно, но слаб"
4,"Это самый глючный телефон на свете. Ему красная цена 300 рублей.
Он тупит. Во всём. Открыть клавиатуру - завис. Открыть телефонную книгу - завис. Открыть браузер - завис. Открыть игру - завис. Хочешь разблокировать экран? Лови чёрный экран на час. 
Динамик тихий и хрипит как умирающий алкаш. 
Уже на следующий день после покупки, у этого чудо кирпича увидел скол около динамика. Внутренний скол и просвет. Не ронял и не бил.
Это самый отвратный телефон. Никогда не берите эту хрень!"
5,"стоит брать,тем более за такие деньги."
6,Пойдет только для звонков и то после оптимизации. Вацап работает нормально. А тормозит смарт из-за нехватки оперативки.
7,"за свой деньги нормальный аппарат что порадовало это экран 6 дюймов ,Встроенная память 128 ГБ,Сканер отпечатка пальца, гаджет уверенно держится на играх , отклик хороший не тупит ,батарейка тоже пока держит норм , намудрили с меню и настройками немного бы упростить"
8,"Купил данную вещицу ради камеры, чтобы была такого же уровня как у сына (у него samsung galaxy 6). К технике Apple привык и менять не хотелось бы, но тут я разочаровался... Камера то теперь дотягивает до уровня Samsung, но как же теперь разговаривать или слушать радио через наушники когда мне нужно его одновременно и зарядить???!!! ЭТО ЧТО ЗА ОБЛОМ??... Придётся видимо менять производителя... (((("
9,"Деградация господа! Убрать миниджек - это шаг в прошлое. Я люблю слушать музыку в больших наушниках и частенько подключал их. Более того, пользовался наушниками и во время зарядки! А теперь я должен стоять перед выбором заряжать мне аппарат или же воткнуть наушники!!!! Пять жирных минусов!!!!!!! Это провал."
10,"Разъем джек убрали, Карл вы серьезно???  Дизайн изменился только выпуклостью камеры, ах да, ну и глянец, который закроется бампером или чехлом, ну а если нет, то будет весь изляпан и исцарапан, да и партия их ограниченная. Крутая камера? Да ну))  По тестам не лучше чем у Самсунга седьмого. В темное время суток Самсунг даже лучше себя показал, да и класс водозащиты у Самсунга выше. Не стали делать поддержку беспроводной зарядки и fast charge? Красавцы ребят, зачем эта функция вообще нужна топовому флагману. Ну а разрешения дисплея оставляет желать лучшего. В общем вновь разочарование, а не смартфон."
11,"Ужасно мылит, как дешёвый телефон за 4-5 тыс. рублей. Все возможные манипуляции, отключение украшалок, сбросы настроек и установка google камеры - мало что меняет. Телефон снимает слабо, хотя много от него и не ждал, но не настолько убого. Разочарован в покупке."
12,"Добрый день, в целом для 2020 года слишком простенькая модель, не уверен, что эппле на ней сильно заработает, да и сама компания сдувается, идеи иссякли, работают на прежних наработках. Если так и дальше пойдет, через пару лет уйдут с лидирующих позиций"
13,В комплекте наушники и зарядка
14,"Батарея держала очень прилично,и не мог понять почему его хаят за батарею,но потом сдулся.Начались тормоза ,раз пять зависал с последующей перезагрузкой!Экран не выходил из спящего режима,хотя приходили сообщения ,отдача кнопки Хом и остальные звуки.Сдал в сервис.интересно ,что скажут.Советы по полному сбросу и обновлению не помогли"
15,Всплывают постоянные уведомления-типо загрузите гугл систему. Браузер Яндекс только
16,"Дико неудобно, что не поддерживает гугл, разочарование"
17,"Царапается, если его залить водой то по гарантии не вернут деньги, БОЛЬШОЙ РАЗВОД не ведитесь яблоко гнилое стало....."
18,"Не все приложения поддерживаются, но общей работой дочь довольна"
19,"Телефон очень ужасный,Iphone самый не любимый мой телефон"
20,"Android приложения, на мой взгляд, содержат меньше багов, да и система постабильнее будет.
 работаю сам  iOS разработчиком более 2,5 лет, поэтому решил всё таки купить айфон, хотя пользовался обычно Android смартом. Заказал из Германии за ~730 евро. Знаю внутренности iOS и как там всё печально, это отражается на всех приложениях. Что касается так часто упоминаемого отказа от 3,5 мм джека, считаю это минус. Музыку слушаю в плеере боле качественным"
21,"Глупое решение убрать гнездо для наушников. Как теперь слушать музыку? Обычные без переходника не подключишь, переходник - это геморрой, неудобно, громоздко, потерять можно... Беспроводные тоже не вариант - замучаешься подзаряжать каждый раз. Короче - сплошные расстройства. Хотел было брать новинку, но как узнал что без гнезда для наушников, передумал. Теперь точно возьму 6-ку, благо подешевели немного."
22,"Прикольный дизайн, особенно в синем цвете. Сам по себе телефон слабый, но справляется с простыми приложениями: мессенджерами, соц. сетями, слабыми играми. В игры  мощней не поиграть просто по недостатку памяти. Хорошо держит зарядку, в меру пользуясь интернетом аккумулятор стабильно продержит день. Если покупать вместе с баллами, то выгодное предложение, если без , то можно подобрать что-то лучше."
23,"Телефон не соответствует описанию на сайте, очень не приятно. На фотографии он с кнопкой сзади, по факту кнопки нет, процессор 4х ядерный Медиа Тек, а не 8 ядерный Qualcomm. Хочу всех предупредить проверяйте описание на сайте перед покупкой."
24,"Почитала я тут отзывы и обрадовалась, пошла купила, а на деле оказалось, что телефон постояно перезагружается (оперативки очень мало), динамик тихий и батареи от силы хватает на пару часов. Результат : через день пошла сдавать в магазин на экспертизу. Никому этот телефон не советую."
25,"Будьте внимательны при покупке. Телефон записывает видео с отчетливым посторонним звуком. Отправляла в СЦ на диагностику, сказали, что это не является браком. Но есть одно, НО..у знакомой точно такая же модель, и никаких посторонних звуков при записи видео. Очень разочарована."
26,сам телефон неплохой но батарея перестала заряжаться при включенном телефоне а наоборот процент заряда батареи падает до 0% ! но так продолжаеться пару дней потом пять норм и так с переодичностью раз в месяц на пару дней!
27,"плюсы: 5 дюймов, хорошая начинка, отличный дисплей"
28,"Телефон работает нормально, дизайн очень даже привлекательный, но вот камера и звук оставляют желать лучшего. При звонке в скайпе камера очень темная, что видно только силуэт. И при разговоре очень плохо слышно собеседника и меня никто не слышит. Возможно мне такой попался, пойду разбираться. Если бы не эти минусы, могла бы советовать,а так не рекомендую"
29,Смартфон красивый.шустрый.экран яркий.все хорошо.только через 2 дня вырубился и больше не включается.вот такая печальная история.поэтому не надо сырые смарты покупать.
30,"Жалею что приобрел этот телефон. Через 3 месяца разбил, очень хрупкий, не выдержал падения)))), не покупайте"
31,"покупал для навигатора и прсмотра онлайн, сказали бери этот. взял - а навигатор по уже указанной причине не работает. если навигатор не нужен, за эти деньги очень рекомендую"
32,"если покупаете не для игр, то хорош."
33,"Не советую к приобретению! Редкостный хлам. Экран при малейшем наклоне засвечивается, такого я нигде не видел еще, все сливается, картинка не сочная, разряжается быстро даже при самом минимальном значении яркости экрана, сам корпус весь скрипит, сенсорная чувствительность отвратительная, в самым слабых играх постоянно тормоза, сеть по крайней мере на первой сим-карте даже в центре города пропадает либо слабая, про камеру лучше промолчу. Единственное это более менее слышимый внешний динамик при звонках, при разговоре также проблем не выявлено, иногда бывает плохо слышат на той стороне линии. Не стоит своих денег, за такую сумму есть намного лучше конкуренты!"
34,"Зарядка держится плохо, передача данных отвратительная,  wi-fi не ловит не одной точки. Использовать только как обычный телефон.  Лучше купить другую модель"
35,"Как уже писали, с GPS у него явные проблемы... Но вот чего точно не ожидал, так это объем памяти - вместо заявленных 4GB ОЗУ, доступно ВСЕГО 2GB !!!
Придется снова идти в магазин и разбираться, в чем проблема, что за ерунда...
Совершенно непонятно, КАК такое возможно!!!"
36,Через три недели запищал разговорный динамик
37,"Только купил, не могу сказать."
38,"Приобрел телефон в июне 2017. Сегодня при попытке набора номера обнаружил, что из 100 примерно абонентских номеров оказались удалены все, за исключением шести из списка ""избранные"". Это уже второй случай за 4 месяца. Заставляет задуматься, не приобрести ли другую модель. Выводы делайте сами. Да, и чувствительность сенсорную не мешало бы улучшить."
39,"Ужасный телефон,накрылся сразу,даже не успела попользоваться. Заряд не держится,от  3G интернета выключается"
40,НЕ СОВЕТУЮ ЕГО ПОКУПАТЬ В НЕМ ОДНИ МИНУСЫ БАТАРЕЯ ГЛЮЧИТ ОН САМ ПО СЕБЕ ВЫКЛЮЧАЕТСЯ ПАМЯТИ НЕТ ВООБЩЕ КАМЕРА УЖАСНА СВЯЗЬ ПЛОХАЯ ВООБЩЕ
41,покупайте очень хороши и удобний чехлы есть на него
42,Не советую эту модель  она ужасна
43,"Не повезло с телефоном. Через 3-4 месяца с начала эксплуатации возникла проблема со встроенным динамиком: я слышу, меня нет. Т.к. телефон был на гарантии. отремонтировали бесплатно в течении 10 дней. затем через полгода проблема с аккумулятором-на 57 % резкое падение зарядки и телефон просто отключается. Замена батареи в течении 1 месяца, т.к. нет в наличии таких аккумуляторов, пришлось заказывать. Слабое гнездо (то бишь разъем)."
44,"Месяц в пользовании, как терплю не знаю. Андроид 4.0 прелесть на  этом 5.0 хуже не придумаешь. Мелодию индивидуально на входящий не поставить?! При двойном клике на ""Рабочем столе"" изображение УВЕЛИЧИВАЕТСЯ?! и т.д."
45,"пробыл в пользовании ровно неделю!
подтормаживает
батарею держит слабо
при звонках очень тихо слышно собеседника
постоянно теряет связь
можно за эти деньги поискать модели поинтереснее"
46,В руке достаточно большой. Придётся купить держатель чтобы не выпадал из руки при наборе текста.
47,"Смартфон для повседневного пользования с возможностью выхода в интернет. HD экран с разрешением 1440x720 и  IPS матрицей. Камера одна на 8 Мп, снимки делает плохие, очень много шумов. Процессор имеет четыре ядра и  производительности у него хватает только на социальные сети. Из положительного можно найти разъём под две сим карты. Так же имеется слот под карту памяти, поддерживаются карты до 256 Гб. Вес телефона небольшой и составляет 142 грамма."
48,"Бюджетный телефон со слабым процессором и малым объёмом оперативной памяти. Из плюсом можно отметить большой HD экран, две камера которые на 8 и 5 МП соответственно. Снимки получаться низкого качества с обилием шума и недостаточной резкостью, в темноте снимать нельзя. Динамик достаточно громкий, на максимальной громкости немного шипит. Корпус пластиковый и быстро покрывается мелкими царапинами. При работе нагревается сразу в районе камеры."
49,"Телефоном пользуюсь уже 3 месяца. Самое большое разочарование в нем это то что он часто тормозит, особенно при использовании камеры. Если у вас есть маленький ребёнок нужно сильно постараться сделать нормальный снимок. В целом сейчас жалею что не взял А50, думаю бОльший объём оперативной памяти решает эту проблему."
50,Крайне посредственная и сырая модель.
51,"Подойдёт для совсем маленького ребёнка, который ещё не может ничего с телефоном делать или для старика с аналогичными способностями... Честно, не ожидала, что в современном мире технологий может существовать такое качество..."
52,Телефон с явными конструктивными дефектами. Своих денег точно не стоит!
53,"Если бы не все эти перечисленные серьёзные недостатки, смартфон получился бы действительно флагманом. Смартфон своих денег точно не стоит."
54,"Через полгода использования телефон тупо завис, помогла его воскресить перепрошивка. Еще через 10 месяцев, случилось тоже самое - в ремонте сказали, что дешевле будет купить новый. В общем, не советую, лучше подкопить и взять самый бюджетный Ксиоми, как вариант."
55,"Покупал как замену рабочему кнопочному телефону, т.к. без WhatsApp теперь ни как не обойтись. Для переписки по WhatsApp подойдет, но не для разговоров. Решил сэкономить, теперь понимаю что нужно было брать другую модель подороже."
56,"было бы все супер тем более за такую цену. НО! заказали дополнительно sdкарту на 32 Гб и  постоянно выскакивает что недостаточно памяти. хотя в хранилище он пишет общую память телефона с sdкартой как и положено. муж что только не делал не выбирал при выборе когда вставляешь флешку и всеравно одно и тоже. ребенок расстроен покупался на новый год в подарок, ребенок любит снимать видео, а получается постоянно приходится удалять. очень это раздражает ребенка и меня видя как ребенок мучается. полностью своей цены не стоит(6500)!!! максимум 4000!"
57,"Одним словом никому не советую, даже за такую маленькую сумму есть смартфоны куда лучше по всем параметрам."
58,"Лично мне после долгих лет ходьбы с разбитым экраном экран этого телефона кажется очень даже достойным, на нем весьма удобно читать книги и смотреть видео. Цвета сочные,приятные глазу. Расположение фонарика не во всех ситуациях удобны (к примеру,чтобы найти вещь попавшую под кровать,фонарь,расположенный по середине крышки окажется почти бесполезен). Надписи не раздражают,как и камера-капелька, а первые (на задней крышке) может закрыть заводской черный чехол с крышкой для USB разъема. Камера совершенно постная ,сравнимая с моим старым Xiaomi Redmi 3s, так что она точно не должна заострять на себе ваше внимание при выборе смартфона."
